{
  "$schema": "https://json-schema.org/draft/2020-12/schema",
  "$id": "https://pictos.net/schemas/pictonet-nlu-1.0.schema.json",
  "title": "PictoNet-NLU-Schema v1.0",
  "description": "Cross-modal semantic contract between the NLU front-end and the SVG compiler.",
  "type": "object",
  "unevaluatedProperties": false,
  "required": ["utterance", "lang", "frames", "logical_form"],
  "properties": {
    "utterance": {
      "type": "string",
      "minLength": 1,
      "description": "Surface string as received."
    },
    "lang": {
      "type": "string",
      "description": "IETF BCP-47 language tag (e.g., en, en-NZ, es-CL).",
      "pattern": "^[A-Za-z]{2,3}(-[A-Za-z0-9]{2,8})*$"
    },
    "metadata": {
      "type": "object",
      "description": "Lightweight communicative metadata.",
      "unevaluatedProperties": false,
      "required": ["speech_act", "intent"],
      "properties": {
        "speech_act": {
          "type": "string",
          "description": "Dialogue-act class.",
          "enum": ["assertive", "directive", "commissive", "expressive", "declarative", "interrogative"]
        },
        "intent": {
          "type": "string",
          "description": "Sub-type of communicative intention.",
          "enum": [
            "request",
            "command",
            "suggestion",
            "reminder",
            "warning",
            "inform",
            "ask_info",
            "confirm",
            "deny",
            "greet",
            "other"
          ]
        },
        "timestamp": {
          "type": "string",
          "format": "date-time",
          "description": "ISO 8601 timestamp of utterance capture."
        },
        "speaker_id": {
          "type": "string",
          "description": "Optional speaker identifier."
        }
      }
    },
    "frames": {
      "type": "array",
      "description": "Frame-semantic analysis units.",
      "minItems": 1,
      "items": {
        "$ref": "#/$defs/FrameObject"
      }
    },
    "nsm_explictations": {
      "type": "object",
      "description": "NSM primes or paraphrases keyed by concept label (preferred key).",
      "additionalProperties": {
        "type": "string"
      },
      "default": {},
      "deprecated": false
    },
    "NSM_explictations": {
      "type": "object",
      "description": "Legacy/alternate key for NSM content (accepted for compatibility).",
      "additionalProperties": {
        "type": "string"
      },
      "default": {},
      "deprecated": true
    },
    "logical_form": {
      "$ref": "#/$defs/LogicalForm"
    },
    "pragmatics": {
      "$ref": "#/$defs/Pragmatics"
    },
    "visual_guidelines": {
      "$ref": "#/$defs/VisualGuidelines"
    }
  },
  "$defs": {
    "FrameObject": {
      "type": "object",
      "unevaluatedProperties": false,
      "required": ["frame_name", "lexical_unit", "roles"],
      "properties": {
        "frame_name": {
          "type": "string",
          "minLength": 1,
          "description": "Canonical FrameNet-like label (e.g., Directed_action, Desire)."
        },
        "lexical_unit": {
          "type": "string",
          "minLength": 1,
          "description": "Triggering lemma or expression."
        },
        "roles": {
          "type": "object",
          "description": "Map of frame elements to role fillers.",
          "minProperties": 1,
          "additionalProperties": {
            "$ref": "#/$defs/RoleFiller"
          }
        },
        "id": {
          "type": "string",
          "description": "Optional local ID for cross-referencing between frames."
        }
      }
    },
    "RoleFiller": {
      "type": "object",
      "description": "Participant, object, or event filling a frame role.",
      "unevaluatedProperties": false,
      "properties": {
        "type": {
          "type": "string",
          "enum": [
            "Agent",
            "Addressee",
            "Speaker",
            "Experiencer",
            "Patient",
            "Theme",
            "Beneficiary",
            "Instrument",
            "Object",
            "Event",
            "Location",
            "Time",
            "Other"
          ]
        },
        "ref": {
          "type": "string"
        },
        "surface": {
          "type": "string"
        },
        "lemma": {
          "type": "string"
        },
        "definiteness": {
          "type": "string",
          "enum": ["definite", "indefinite", "unspecified"]
        },
        "ref_frame": {
          "type": "string"
        }
      }
    },
    "LogicalForm": {
      "type": "object",
      "unevaluatedProperties": false,
      "required": ["event"],
      "properties": {
        "event": {
          "type": "string"
        },
        "modality": {
          "type": "string"
        },
        "negation": {
          "type": "boolean"
        },
        "aspect": {
          "type": "string",
          "enum": ["none", "progressive", "perfective", "habitual", "inceptive", "custom"]
        },
        "tense": {
          "type": "string",
          "enum": ["past", "present", "future", "unspecified"]
        }
      }
    },
    "Pragmatics": {
      "type": "object",
      "unevaluatedProperties": false,
      "properties": {
        "politeness": {
          "type": "string",
          "enum": ["polite", "neutral", "impolite"]
        },
        "formality": {
          "type": "string",
          "enum": ["informal", "neutral", "formal"]
        },
        "expected_response": {
          "type": "string",
          "enum": ["compliance", "refusal", "acknowledgment", "question", "silence", "other"]
        },
        "urgency": {
          "type": "string",
          "enum": ["low", "medium", "high"]
        },
        "speaker_stance": {
          "type": "string"
        }
      }
    },
    "VisualGuidelines": {
      "type": "object",
      "unevaluatedProperties": false,
      "properties": {
        "focus_actor": {
          "type": "string"
        },
        "secondary_actor": {
          "type": "string"
        },
        "action_core": {
          "type": "string"
        },
        "object_core": {
          "type": "string"
        },
        "context": {
          "type": "string"
        },
        "temporal": {
          "type": "string",
          "enum": ["immediate", "near_future", "future", "past", "habitual", "unspecified"]
        },
        "salience": {
          "type": "object",
          "additionalProperties": {
            "type": "number",
            "minimum": 0,
            "maximum": 1
          }
        }
      }
    }
  },
  "allOf": [{
    "if": {
      "type": "object",
      "properties": {
        "metadata": {}
      },
      "required": ["metadata"]
    },
    "then": {
      "not": {
        "anyOf": [{
            "type": "object",
            "properties": {
              "speech_act": {}
            },
            "required": ["speech_act"]
          },
          {
            "type": "object",
            "properties": {
              "intent": {}
            },
            "required": ["intent"]
          }
        ]
      }
    }
  }]
}